match_type,value
intersection,abalone
intersection,"adobo, with noodles"
intersection,"adobo, with rice"
intersection,agave liquid sweetener
intersection,alcoholic coffee drink
intersection,alcoholic malt beverage
intersection,"alcoholic malt beverage, sweetened"
intersection,"alfalfa sprouts, raw"
intersection,alfredo sauce
intersection,alfredo sauce with added vegetables
intersection,alfredo sauce with meat
intersection,alfredo sauce with meat and added vegetables
intersection,alfredo sauce with poultry
intersection,alfredo sauce with poultry and added vegetables
intersection,alfredo sauce with seafood
intersection,alfredo sauce with seafood and added vegetables
intersection,almond butter
intersection,"almond butter and jelly sandwich, on wheat bread"
intersection,"almond butter and jelly sandwich, on white bread"
intersection,"almond butter sandwich, on wheat bread"
intersection,"almond butter sandwich, on white bread"
intersection,"almond butter, lower sodium"
intersection,almond chicken
intersection,"almond milk, chocolate"
intersection,"almond milk, nfs"
intersection,"almond milk, sweetened"
intersection,"almond milk, unsweetened"
intersection,almond oil
intersection,almond paste
intersection,"almonds, chocolate covered candy"
intersection,"almonds, flavored"
intersection,"almonds, honey roasted"
intersection,"almonds, lightly salted"
intersection,"almonds, nfs"
intersection,"almonds, salted"
intersection,"almonds, unroasted"
intersection,"almonds, unsalted"
intersection,aloe vera juice drink
intersection,ambrosia
intersection,animal fat or drippings
intersection,anisette toast
intersection,"antipasto with ham, fish, cheese, vegetables"
intersection,apple cider
intersection,"apple juice beverage, 40-50% juice, light"
intersection,"apple juice, 100%"
intersection,"apple juice, 100%, with calcium added"
intersection,apple pie filling
intersection,apple salad with dressing
intersection,"apple, baked"
intersection,"apple, candied"
intersection,"apple, dried"
intersection,"apple, raw"
intersection,"applesauce, flavored"
intersection,"applesauce, regular"
intersection,"applesauce, unsweetened"
intersection,apricot nectar
intersection,"apricot, canned"
intersection,"apricot, dried"
intersection,"apricot, raw"
intersection,arepa dominicana
intersection,armadillo
intersection,artichoke
intersection,artichoke dip
intersection,"artichokes, stuffed"
intersection,"asian chicken or turkey garden salad with crispy noodles, chicken and/or turkey, lettuce, fruit, nuts, crispy noodles, no dressing"
intersection,"asian chicken or turkey garden salad, chicken and/or turkey, lettuce, fruit, nuts, no dressing"
intersection,"asian stir fry vegetables, cooked, fat added"
intersection,"asian stir fry vegetables, cooked, no added fat"
intersection,"asparagus, canned, cooked with butter or margarine"
intersection,"asparagus, canned, cooked with oil"
intersection,"asparagus, canned, cooked, fat added, ns as to fat type"
intersection,"asparagus, canned, cooked, no added fat"
intersection,"asparagus, fresh, cooked with butter or margarine"
intersection,"asparagus, fresh, cooked with oil"
intersection,"asparagus, fresh, cooked, fat added, ns as to fat type"
intersection,"asparagus, fresh, cooked, no added fat"
intersection,"asparagus, frozen, cooked with butter or margarine"
intersection,"asparagus, frozen, cooked with oil"
intersection,"asparagus, frozen, cooked, fat added, ns as to fat type"
intersection,"asparagus, frozen, cooked, no added fat"
intersection,"asparagus, ns as to form, cooked"
intersection,"asparagus, raw"
intersection,atole
intersection,atole de avena
intersection,atole de chocolate
intersection,avocado dressing
intersection,"avocado, for use on a sandwich"
intersection,"avocado, raw"
intersection,"baby toddler apples, stage 1"
intersection,"baby toddler apples, stage 2"
intersection,"baby toddler bananas, stage 1"
intersection,"baby toddler bananas, stage 2"
intersection,baby toddler bar
intersection,baby toddler beef
intersection,baby toddler beets
intersection,baby toddler biscuit
intersection,"baby toddler carrots, stage 1"
intersection,"baby toddler carrots, stage 2"
intersection,"baby toddler cereal, barley, dry"
intersection,"baby toddler cereal, multigrain with fruit, dry"
intersection,"baby toddler cereal, multigrain with fruit, ready-to-eat"
intersection,"baby toddler cereal, multigrain, dry"
intersection,"baby toddler cereal, multigrain, ready-to-eat"
intersection,"baby toddler cereal, nfs"
intersection,"baby toddler cereal, oatmeal with fruit, dry"
intersection,"baby toddler cereal, oatmeal with fruit, ready-to-eat"
intersection,"baby toddler cereal, oatmeal, dry"
intersection,"baby toddler cereal, oatmeal, ready-to-eat"
intersection,"baby toddler cereal, rice with fruit, dry"
intersection,"baby toddler cereal, rice with fruit, ready-to-eat"
intersection,"baby toddler cereal, rice, dry"
intersection,"baby toddler cereal, rice, ready-to-eat"
intersection,baby toddler chicken
intersection,baby toddler cookie
intersection,baby toddler crackers
intersection,baby toddler crunchies
intersection,"baby toddler food, nfs"
intersection,baby toddler fruit and meat
intersection,"baby toddler fruit and vegetables, stage 2"
intersection,"baby toddler fruit and vegetables, stage 3"
intersection,"baby toddler fruit and vegetables, with grain"
intersection,"baby toddler fruit and vegetables, with yogurt"
intersection,"baby toddler fruit, nfs"
intersection,"baby toddler fruit, vegetables, and meat"
intersection,"baby toddler fruit, with grain"
intersection,"baby toddler fruit, with yogurt"
intersection,"baby toddler green beans, stage 1"
intersection,"baby toddler green beans, stage 2"
intersection,baby toddler ham
intersection,"baby toddler juice, apple"
intersection,"baby toddler juice, fruit and vegetable"
intersection,"baby toddler juice, fruit and yogurt blend"
intersection,"baby toddler juice, grape"
intersection,"baby toddler juice, mixed fruit"
intersection,"baby toddler juice, nfs"
intersection,"baby toddler juice, pear"
intersection,baby toddler mangoes
intersection,baby toddler meat stick
intersection,"baby toddler meat, nfs"
intersection,"baby toddler multiple fruit, stage 2"
intersection,"baby toddler multiple fruit, stage 3"
intersection,"baby toddler multiple vegetables, stage 2"
intersection,"baby toddler multiple vegetables, stage 3"
intersection,"baby toddler peaches, stage 1"
intersection,"baby toddler peaches, stage 2"
intersection,"baby toddler pears, stage 1"
intersection,"baby toddler pears, stage 2"
intersection,"baby toddler peas, stage 1"
intersection,"baby toddler peas, stage 2"
intersection,baby toddler prunes
intersection,baby toddler pudding
intersection,"baby toddler puffs, fruit"
intersection,"baby toddler puffs, vegetable"
intersection,"baby toddler snack, nfs"
intersection,"baby toddler squash, stage 1"
intersection,"baby toddler squash, stage 2"
intersection,"baby toddler sweet potatoes, stage 1"
intersection,"baby toddler sweet potatoes, stage 2"
intersection,baby toddler turkey
intersection,"baby toddler vegetable, nfs"
intersection,baby toddler vegetables and meat
intersection,"baby toddler vegetables, with grain"
intersection,baby toddler wheels
intersection,baby toddler yogurt melts
intersection,"baby toddler yogurt, plain"
intersection,"baby toddler yogurt, with fruit"
intersection,bacalaitos fritos
intersection,bacon and tomato dressing
intersection,bacon biscuit sandwich
intersection,bacon bits
intersection,"bacon or side pork, fresh, cooked"
intersection,"bacon strip, meatless"
intersection,"bacon, for use on a sandwich"
intersection,"bacon, for use with vegetables"
intersection,"bacon, lettuce, tomato sandwich on wheat"
intersection,"bacon, lettuce, tomato sandwich on white"
intersection,"bacon, ns as to type of meat, cooked"
intersection,"bacon, ns as to type of meat, reduced sodium, cooked"
intersection,bagel
intersection,bagel chips
intersection,"bagel, multigrain"
intersection,"bagel, multigrain, with raisins"
intersection,"bagel, oat bran"
intersection,"bagel, pumpernickel"
intersection,"bagel, wheat"
intersection,"bagel, wheat bran"
intersection,"bagel, wheat, with fruit and nuts"
intersection,"bagel, wheat, with raisins"
intersection,"bagel, whole grain white"
intersection,"bagel, whole wheat"
intersection,"bagel, whole wheat, with raisins"
intersection,"bagel, with fruit other than raisins"
intersection,"bagel, with raisins"
intersection,baked beans
intersection,baked beans from fast food / restaurant
intersection,"baked beans, reduced sodium"
intersection,"baked beans, vegetarian"
intersection,baklava
intersection,"bamboo shoots, cooked"
intersection,banana chips
intersection,banana nectar
intersection,banana pudding
intersection,banana split
intersection,"banana, baked"
intersection,"banana, raw"
intersection,bao bun
intersection,"bao bun, no meat"
intersection,"barbecue beef sandwich, on wheat bun"
intersection,"barbecue beef sandwich, on white bun"
intersection,"barbecue beef, no sauce"
intersection,"barbecue beef, with sauce"
intersection,barbecue chicken
intersection,"barbecue chicken sandwich, on wheat bun"
intersection,"barbecue chicken sandwich, on white bun"
intersection,"barbecue meat, nfs"
intersection,"barbecue pork sandwich, on wheat bun"
intersection,"barbecue pork sandwich, on white bun"
intersection,"barbecue pork, no sauce"
intersection,"barbecue pork, with sauce"
intersection,barbecue rib sandwich
intersection,"barbecue sandwich, nfs"
intersection,barbecue sauce
intersection,"barfi or burfi, indian dessert"
intersection,barley
intersection,basbousa
intersection,"basil, raw"
intersection,bean cake
intersection,bean chips
intersection,"bean dip, made with refried beans"
intersection,"bean paste, sweetened"
intersection,"bean salad, yellow and/or green string beans"
intersection,"bean sprouts, cooked"
intersection,"bean sprouts, raw"
intersection,beans and brown rice
intersection,beans and franks
intersection,"beans and rice, from fast food / restaurant"
intersection,"beans and rice, with meat"
intersection,"beans and rice, with tomatoes"
intersection,"beans and tomatoes, fat added"
intersection,"beans and tomatoes, no added fat"
intersection,beans and white rice
intersection,"beans with meat, ns as to type"
intersection,"beans, from canned, ns as to type, fat added"
intersection,"beans, from canned, ns as to type, no added fat"
intersection,"beans, from dried, ns as to type, fat added"
intersection,"beans, from dried, ns as to type, no added fat"
intersection,"beans, from fast food / restaurant, ns as to type"
intersection,"beans, nfs"
intersection,bear
intersection,beaver
intersection,beef and broccoli
intersection,beef and macaroni with cheese sauce
intersection,beef and noodles with cream or white sauce
intersection,beef and noodles with gravy
intersection,beef and noodles with mushroom sauce
intersection,beef and noodles with soy-based sauce
intersection,beef and noodles with tomato-based sauce
intersection,"beef and noodles, no sauce"
intersection,beef and potatoes with cheese sauce
intersection,"beef and potatoes with cream sauce, white sauce or mushroom sauce"
intersection,"beef and potatoes, no sauce"
intersection,beef and rice with cheese sauce
intersection,beef and rice with cream sauce
intersection,beef and rice with gravy
intersection,beef and rice with mushroom sauce
intersection,beef and rice with soy-based sauce
intersection,beef and rice with tomato-based sauce
intersection,"beef and rice, no sauce"
intersection,"beef and vegetables excluding carrots, broccoli, and dark-green leafy; no potatoes, gravy"
intersection,"beef and vegetables excluding carrots, broccoli, and dark-green leafy; no potatoes, no sauce"
intersection,"beef and vegetables excluding carrots, broccoli, and dark-green leafy; no potatoes, soy-based sauce"
intersection,"beef and vegetables including carrots, broccoli, and/or dark-green leafy; no potatoes, gravy"
intersection,"beef and vegetables including carrots, broccoli, and/or dark-green leafy; no potatoes, no sauce"
intersection,"beef and vegetables including carrots, broccoli, and/or dark-green leafy; no potatoes, soy-based sauce"
intersection,"beef and vegetables, hawaiian style"
intersection,beef as ingredient in recipes
intersection,beef burgundy
intersection,beef chow mein or chop suey with noodles
intersection,"beef chow mein or chop suey, no noodles"
intersection,beef curry
intersection,beef curry with rice
intersection,"beef dinner, nfs, frozen meal"
intersection,beef egg foo yung
intersection,beef jerky
intersection,"beef rolls, stuffed with vegetables or meat mixture, tomato-based sauce"
intersection,beef salad
intersection,beef sausage
intersection,beef sausage with cheese
intersection,"beef shish kabob with vegetables, excluding potatoes"
intersection,"beef steak with onions, puerto rican style"
intersection,"beef stew with potatoes, puerto rican style"
intersection,beef stroganoff
intersection,beef stroganoff with noodles
intersection,"beef taco filling: beef, cheese, tomato, taco sauce"
intersection,beef wellington
intersection,beef with cream or white sauce
intersection,beef with gravy
intersection,beef with mushroom sauce
intersection,beef with soy-based sauce
intersection,"beef with spaetzle or rice, vegetable, frozen meal"
intersection,beef with sweet and sour sauce
intersection,beef with tomato-based sauce
intersection,"beef with vegetable, diet frozen meal"
intersection,"beef with vegetables excluding carrots, broccoli, and dark-green leafy; no potatoes, mushroom sauce"
intersection,"beef with vegetables excluding carrots, broccoli, and dark-green leafy; no potatoes, tomato-based sauce"
intersection,"beef with vegetables including carrots, broccoli, and/or dark-green leafy; no potatoes, mushroom sauce"
intersection,"beef with vegetables including carrots, broccoli, and/or dark-green leafy; no potatoes, tomato-based sauce"
intersection,"beef, bacon, cooked"
intersection,"beef, bacon, reduced sodium, cooked"
intersection,"beef, brisket"
intersection,"beef, corned"
intersection,"beef, cow head"
intersection,"beef, dried, chipped, cooked in fat"
intersection,"beef, dried, chipped, uncooked"
intersection,"beef, dumplings, and vegetables excluding carrots, broccoli, and dark-green leafy; gravy"
intersection,"beef, dumplings, and vegetables including carrots, broccoli, and/or dark-green leafy; gravy"
intersection,"beef, for use with vegetables"
intersection,"beef, ground"
intersection,"beef, ground, patty"
intersection,"beef, ground, raw"
intersection,"beef, ground, with egg and onion"
intersection,"beef, neck bones"
intersection,"beef, nfs"
intersection,"beef, noodles, and vegetables excluding carrots, broccoli, and dark-green leafy; gravy"
intersection,"beef, noodles, and vegetables excluding carrots, broccoli, and dark-green leafy; mushroom sauce"
intersection,"beef, noodles, and vegetables excluding carrots, broccoli, and dark-green leafy; no sauce"
intersection,"beef, noodles, and vegetables excluding carrots, broccoli, and dark-green leafy; soy-based sauce"
intersection,"beef, noodles, and vegetables excluding carrots, broccoli, and dark-green leafy; tomato-based sauce"
intersection,"beef, noodles, and vegetables including carrots, broccoli, and/or dark-green leafy; gravy"
intersection,"beef, noodles, and vegetables including carrots, broccoli, and/or dark-green leafy; mushroom sauce"
intersection,"beef, noodles, and vegetables including carrots, broccoli, and/or dark-green leafy; no sauce"
intersection,"beef, noodles, and vegetables including carrots, broccoli, and/or dark-green leafy; soy-based sauce"
intersection,"beef, noodles, and vegetables including carrots, broccoli, and/or dark-green leafy; tomato-based sauce"
intersection,"beef, oxtails"
intersection,"beef, pot roast"
intersection,"beef, potatoes, and vegetables excluding carrots, broccoli, and dark-green leafy; cheese sauce"
intersection,"beef, potatoes, and vegetables excluding carrots, broccoli, and dark-green leafy; cream sauce, white sauce, or mushroom sauce"
intersection,"beef, potatoes, and vegetables excluding carrots, broccoli, and dark-green leafy; gravy"
intersection,"beef, potatoes, and vegetables excluding carrots, broccoli, and dark-green leafy; soy-based sauce"
intersection,"beef, potatoes, and vegetables excluding carrots, broccoli, and dark-green leafy; tomato-based sauce"
intersection,"beef, potatoes, and vegetables including carrots, broccoli, and/or dark-green leafy; cheese sauce"
intersection,"beef, potatoes, and vegetables including carrots, broccoli, and/or dark-green leafy; cream sauce, white sauce, or mushroom sauce"
intersection,"beef, potatoes, and vegetables including carrots, broccoli, and/or dark-green leafy; gravy"
intersection,"beef, potatoes, and vegetables including carrots, broccoli, and/or dark-green leafy; no sauce"
intersection,"beef, potatoes, and vegetables including carrots, broccoli, and/or dark-green leafy; soy-based sauce"
intersection,"beef, potatoes, and vegetables including carrots, broccoli, and/or dark-green leafy; tomato-based sauce"
intersection,"beef, potatoes, and vegetables, excluding carrots, broccoli, and dark-green leafy; no sauce"
intersection,"beef, prepackaged or deli, luncheon meat"
intersection,"beef, prepackaged or deli, luncheon meat, reduced sodium"
intersection,"beef, rice, and vegetables excluding carrots, broccoli, and dark-green leafy; cheese sauce"
intersection,"beef, rice, and vegetables excluding carrots, broccoli, and dark-green leafy; gravy"
intersection,"beef, rice, and vegetables excluding carrots, broccoli, and dark-green leafy; mushroom sauce"
intersection,"beef, rice, and vegetables excluding carrots, broccoli, and dark-green leafy; no sauce"
intersection,"beef, rice, and vegetables excluding carrots, broccoli, and dark-green leafy; soy-based sauce"
intersection,"beef, rice, and vegetables excluding carrots, broccoli, and dark-green leafy; tomato-based sauce"
intersection,"beef, rice, and vegetables including carrots, broccoli, and/or dark-green leafy; cheese sauce"
intersection,"beef, rice, and vegetables including carrots, broccoli, and/or dark-green leafy; gravy"
intersection,"beef, rice, and vegetables including carrots, broccoli, and/or dark-green leafy; mushroom sauce"
intersection,"beef, rice, and vegetables including carrots, broccoli, and/or dark-green leafy; no sauce"
intersection,"beef, rice, and vegetables including carrots, broccoli, and/or dark-green leafy; soy-based sauce"
intersection,"beef, rice, and vegetables including carrots, broccoli, and/or dark-green leafy; tomato-based sauce"
intersection,"beef, roast"
intersection,"beef, roast, hash"
intersection,"beef, sandwich steak"
intersection,"beef, shortribs"
intersection,"beef, sliced, with gravy, potatoes, vegetable, frozen meal"
intersection,"beef, steak, chuck"
intersection,"beef, steak, country fried"
intersection,"beef, steak, cube"
intersection,"beef, steak, flank"
intersection,"beef, steak, nfs"
intersection,"beef, steak, ribeye, lean and fat eaten"
intersection,"beef, steak, ribeye, lean only eaten"
intersection,"beef, steak, ribeye, ns as to fat eaten"
intersection,"beef, steak, round"
intersection,"beef, steak, sirloin, lean and fat eaten"
intersection,"beef, steak, sirloin, lean only eaten"
intersection,"beef, steak, sirloin, ns as to fat eaten"
intersection,"beef, steak, strip, lean and fat eaten"
intersection,"beef, steak, strip, lean only eaten"
intersection,"beef, steak, strip, ns as to fat eaten"
intersection,"beef, steak, t-bone, lean and fat eaten"
intersection,"beef, steak, t-bone, lean only eaten"
intersection,"beef, steak, t-bone, ns as to fat eaten"
intersection,"beef, steak, tenderloin"
intersection,"beef, stew meat"
intersection,"beef, tofu, and vegetables excluding carrots, broccoli, and dark-green leafy; no potatoes, soy-based sauce"
intersection,"beef, tofu, and vegetables including carrots, broccoli, and/or dark-green leafy; no potatoes, soy-based sauce"
intersection,beer
intersection,"beer, higher alcohol"
intersection,"beer, light"
intersection,"beer, nonalcoholic"
intersection,"beet greens, cooked"
intersection,"beet greens, raw"
intersection,beet juice
intersection,"beets, canned, cooked, fat added"
intersection,"beets, canned, cooked, no added fat"
intersection,"beets, canned, reduced sodium, cooked"
intersection,"beets, fresh, cooked, fat added"
intersection,"beets, fresh, cooked, no added fat"
intersection,"beets, ns as to form, cooked"
intersection,"beets, pickled"
intersection,"beets, raw"
intersection,beignet
intersection,"berries, frozen"
intersection,"berries, nfs"
intersection,"bibimbap, korean"
intersection,big mac (mcdonalds)
intersection,biryani with chicken
intersection,biryani with meat
intersection,biryani with vegetables
intersection,"biscayne codfish, puerto rican style"
intersection,biscuit with fruit
intersection,biscuit with gravy
intersection,"biscuit, cheese"
intersection,"biscuit, from fast food / restaurant"
intersection,"biscuit, from refrigerated dough"
intersection,"biscuit, home recipe"
intersection,"biscuit, nfs"
intersection,"biscuit, wheat"
intersection,bison
intersection,"bitter melon, cooked"
intersection,"bitter melon, horseradish, jute, or radish leaves, cooked"
intersection,black bean salad
intersection,black bean sauce
intersection,black beans and brown rice
intersection,"black beans and rice, from fast food / restaurant"
intersection,black beans and white rice
intersection,black beans with meat
intersection,"black beans, from canned, fat added"
intersection,"black beans, from canned, no added fat"
intersection,"black beans, from canned, reduced sodium"
intersection,"black beans, from dried, fat added"
intersection,"black beans, from dried, no added fat"
intersection,"black beans, from fast food / restaurant"
intersection,"black beans, nfs"
intersection,black russian
intersection,"blackberries, frozen"
intersection,"blackberries, raw"
intersection,"blackberry juice, 100%"
intersection,"blackeyed peas, from canned"
intersection,"blackeyed peas, from dried"
intersection,"blackeyed peas, from frozen"
intersection,"blackeyed peas, nfs"
intersection,blood sausage
intersection,bloody mary
intersection,"bluberries, canned"
intersection,blue or roquefort cheese dressing
intersection,"blue or roquefort cheese dressing, fat free"
intersection,"blue or roquefort cheese dressing, light"
intersection,"blueberries, dried"
intersection,"blueberries, frozen"
intersection,"blueberries, raw"
intersection,blueberry juice
intersection,blueberry pie filling
intersection,blueberry syrup
intersection,bologna
intersection,bologna sandwich on wheat
intersection,"bologna sandwich on wheat, with cheese"
intersection,bologna sandwich on white
intersection,"bologna sandwich on white, with cheese"
intersection,"bologna, reduced fat"
intersection,"bologna, reduced sodium"
intersection,brains
intersection,brandy
intersection,brandy alexander
intersection,brandy and cola
intersection,bratwurst
intersection,"bratwurst, with cheese"
intersection,brazil nuts
intersection,bread stuffing
intersection,bread stuffing made with egg
intersection,"bread, barley"
intersection,"bread, barley, toasted"
intersection,"bread, black"
intersection,"bread, black, toasted"
intersection,"bread, boston brown"
intersection,"bread, chappatti or roti"
intersection,"bread, cheese"
intersection,"bread, cheese, toasted"
intersection,"bread, cinnamon"
intersection,"bread, cinnamon, toasted"
intersection,"bread, cornmeal and molasses"
intersection,"bread, cornmeal and molasses, toasted"
intersection,"bread, cuban"
intersection,"bread, cuban, toasted"
intersection,"bread, dough, fried"
intersection,"bread, egg, challah"
intersection,"bread, egg, challah, toasted"
intersection,"bread, french or vienna"
intersection,"bread, french or vienna, toasted"
intersection,"bread, french or vienna, whole wheat"
intersection,"bread, french or vienna, whole wheat, toasted"
intersection,"bread, fruit"
intersection,"bread, gluten free"
intersection,"bread, gluten free, toasted"
intersection,"bread, high protein, toasted"
intersection,"bread, irish soda"
intersection,"bread, italian, grecian, armenian"
intersection,"bread, italian, grecian, armenian, toasted"
intersection,"bread, lard, puerto rican style"
intersection,"bread, lard, toasted, puerto rican style"
intersection,"bread, made from home recipe or purchased at a bakery, ns as to major flour"
intersection,"bread, made from home recipe or purchased at a bakery, toasted, ns as to major flour"
intersection,"bread, marble rye and pumpernickel"
intersection,"bread, marble rye and pumpernickel, toasted"
intersection,"bread, multigrain"
intersection,"bread, multigrain, reduced calorie and/or high fiber"
intersection,"bread, multigrain, reduced calorie and/or high fiber, toasted"
intersection,"bread, multigrain, toasted"
intersection,"bread, multigrain, with raisins"
intersection,"bread, multigrain, with raisins, toasted"
intersection,"bread, naan"
intersection,"bread, native, water, puerto rican style"
intersection,"bread, native, water, toasted, puerto rican style"
intersection,"bread, ns as to major flour"
intersection,"bread, ns as to major flour, toasted"
intersection,"bread, nut"
intersection,"bread, oat bran"
intersection,"bread, oat bran, toasted"
intersection,"bread, oatmeal"
intersection,"bread, oatmeal, toasted"
intersection,"bread, onion"
intersection,"bread, onion, toasted"
intersection,"bread, paratha"
intersection,"bread, pita"
intersection,"bread, pita with fruit"
intersection,"bread, pita, wheat or cracked wheat"
intersection,"bread, pita, whole wheat"
intersection,"bread, potato"
intersection,"bread, potato, toasted"
intersection,"bread, pumpernickel"
intersection,"bread, pumpernickel, toasted"
intersection,"bread, pumpkin"
intersection,"bread, puri"
intersection,"bread, raisin"
intersection,"bread, raisin, toasted"
intersection,"bread, reduced calorie and/or high fiber, white or nfs"
