match_type,value
intersection,"potato salad, made with mayonnaise"
intersection,"potato salad, made with mayonnaise-type salad dressing"
intersection,potato skins without topping
intersection,"potato skins, nfs"
intersection,"potato skins, with cheese"
intersection,"potato skins, with cheese and bacon"
intersection,"potato sticks, flavored"
intersection,"potato sticks, fry shaped"
intersection,"potato sticks, plain"
intersection,"potato tots, fast food / restaurant"
intersection,"potato tots, from fresh, fried or baked"
intersection,"potato tots, frozen, baked"
intersection,"potato tots, frozen, fried"
intersection,"potato tots, frozen, ns as to fried or baked"
intersection,"potato tots, nfs"
intersection,"potato tots, school"
intersection,"potato, baked, nfs"
intersection,"potato, baked, peel eaten"
intersection,"potato, baked, peel eaten, with butter"
intersection,"potato, baked, peel eaten, with cheese"
intersection,"potato, baked, peel eaten, with chili"
intersection,"potato, baked, peel eaten, with meat"
intersection,"potato, baked, peel eaten, with sour cream"
intersection,"potato, baked, peel eaten, with vegetables"
intersection,"potato, baked, peel not eaten"
intersection,"potato, baked, peel not eaten, with butter"
intersection,"potato, baked, peel not eaten, with cheese"
intersection,"potato, baked, peel not eaten, with chili"
intersection,"potato, baked, peel not eaten, with meat"
intersection,"potato, baked, peel not eaten, with sour cream"
intersection,"potato, baked, peel not eaten, with vegetables"
intersection,"potato, boiled, from fresh, peel eaten, fat added, ns as to fat type"
intersection,"potato, boiled, from fresh, peel eaten, made with butter"
intersection,"potato, boiled, from fresh, peel eaten, made with margarine"
intersection,"potato, boiled, from fresh, peel eaten, made with oil"
intersection,"potato, boiled, from fresh, peel eaten, no added fat"
intersection,"potato, boiled, from fresh, peel eaten, ns as to fat"
intersection,"potato, boiled, from fresh, peel not eaten, fat added, ns as to fat type"
intersection,"potato, boiled, from fresh, peel not eaten, made with butter"
intersection,"potato, boiled, from fresh, peel not eaten, made with margarine"
intersection,"potato, boiled, from fresh, peel not eaten, made with oil"
intersection,"potato, boiled, from fresh, peel not eaten, no added fat"
intersection,"potato, boiled, from fresh, peel not eaten, ns as to fat"
intersection,"potato, boiled, nfs"
intersection,"potato, boiled, ready-to-heat"
intersection,"potato, canned, fat added, ns as to fat type"
intersection,"potato, canned, no added fat"
intersection,"potato, canned, ns as to fat"
intersection,"potato, cooked, as ingredient"
intersection,"potato, french fries, fast food"
intersection,"potato, french fries, from fresh, baked"
intersection,"potato, french fries, from fresh, fried"
intersection,"potato, french fries, from frozen, baked"
intersection,"potato, french fries, from frozen, fried"
intersection,"potato, french fries, nfs"
intersection,"potato, french fries, ns as to fresh or frozen"
intersection,"potato, french fries, restaurant"
intersection,"potato, french fries, school"
intersection,"potato, french fries, with cheese"
intersection,"potato, french fries, with cheese, fast food / restaurant"
intersection,"potato, french fries, with cheese, school"
intersection,"potato, french fries, with chili"
intersection,"potato, french fries, with chili and cheese"
intersection,"potato, french fries, with chili and cheese, fast food / restaurant"
intersection,"potato, french fries, with chili, fast food / restaurant"
intersection,"potato, hash brown, from dry mix"
intersection,"potato, hash brown, from fast food"
intersection,"potato, hash brown, from fast food, with cheese"
intersection,"potato, hash brown, from fresh"
intersection,"potato, hash brown, from fresh, with cheese"
intersection,"potato, hash brown, from restaurant"
intersection,"potato, hash brown, from restaurant, with cheese"
intersection,"potato, hash brown, from school lunch"
intersection,"potato, hash brown, nfs"
intersection,"potato, hash brown, ready-to-heat"
intersection,"potato, hash brown, ready-to-heat, with cheese"
intersection,"potato, home fries, from fresh"
intersection,"potato, home fries, from restaurant / fast food"
intersection,"potato, home fries, nfs"
intersection,"potato, home fries, ready-to-heat"
intersection,"potato, home fries, with vegetables"
intersection,"potato, mashed, from dry mix, made with milk"
intersection,"potato, mashed, from dry mix, made with milk, with cheese"
intersection,"potato, mashed, from dry mix, made with milk, with gravy"
intersection,"potato, mashed, from dry mix, nfs"
intersection,"potato, mashed, from fast food"
intersection,"potato, mashed, from fast food, with gravy"
intersection,"potato, mashed, from fresh, made with milk"
intersection,"potato, mashed, from fresh, made with milk, with cheese"
intersection,"potato, mashed, from fresh, made with milk, with gravy"
intersection,"potato, mashed, from fresh, nfs"
intersection,"potato, mashed, from restaurant"
intersection,"potato, mashed, from restaurant, with gravy"
intersection,"potato, mashed, from school lunch"
intersection,"potato, mashed, nfs"
intersection,"potato, mashed, ready-to-heat"
intersection,"potato, mashed, ready-to-heat, nfs"
intersection,"potato, mashed, ready-to-heat, with cheese"
intersection,"potato, mashed, ready-to-heat, with gravy"
intersection,"potato, nfs"
intersection,"potato, roasted, from fresh, peel eaten, fat added, ns as to fat type"
intersection,"potato, roasted, from fresh, peel eaten, made with butter"
intersection,"potato, roasted, from fresh, peel eaten, made with margarine"
intersection,"potato, roasted, from fresh, peel eaten, made with oil"
intersection,"potato, roasted, from fresh, peel eaten, no added fat"
intersection,"potato, roasted, from fresh, peel eaten, ns as to fat"
intersection,"potato, roasted, from fresh, peel not eaten, fat added, ns as to fat type"
intersection,"potato, roasted, from fresh, peel not eaten, made with butter"
intersection,"potato, roasted, from fresh, peel not eaten, made with margarine"
intersection,"potato, roasted, from fresh, peel not eaten, made with oil"
intersection,"potato, roasted, from fresh, peel not eaten, no added fat"
intersection,"potato, roasted, from fresh, peel not eaten, ns as to fat"
intersection,"potato, roasted, nfs"
intersection,"potato, roasted, ready-to-heat"
intersection,"potato, scalloped, from dry mix"
intersection,"potato, scalloped, from dry mix, with meat"
intersection,"potato, scalloped, from fast food or restaurant"
intersection,"potato, scalloped, from fresh"
intersection,"potato, scalloped, from fresh, with meat"
intersection,"potato, scalloped, nfs"
intersection,"potato, scalloped, ready-to-heat"
intersection,"potato, scalloped, ready-to-heat, with meat"
intersection,"pretzel chips, hard, flavored"
intersection,"pretzel chips, hard, gluten free"
intersection,"pretzel chips, hard, plain"
intersection,"pretzels, hard, cheese filled"
intersection,"pretzels, hard, chocolate coated"
intersection,"pretzels, hard, coated, gluten free"
intersection,"pretzels, hard, coated, nfs"
intersection,"pretzels, hard, filled, nfs"
intersection,"pretzels, hard, flavored"
intersection,"pretzels, hard, flavored, gluten free"
intersection,"pretzels, hard, multigrain"
intersection,"pretzels, hard, nfs"
intersection,"pretzels, hard, peanut butter filled"
intersection,"pretzels, hard, plain, gluten free"
intersection,"pretzels, hard, plain, lightly salted"
intersection,"pretzels, hard, plain, salted"
intersection,"pretzels, hard, plain, unsalted"
intersection,"pretzels, hard, white chocolate coated"
intersection,"pretzels, hard, yogurt coated"
intersection,"pretzels, nfs"
intersection,"pretzels, soft, filled with cheese"
intersection,"pretzels, soft, from frozen, cinnamon sugar coated"
intersection,"pretzels, soft, from frozen, coated or flavored"
intersection,"pretzels, soft, from frozen, nfs"
intersection,"pretzels, soft, from frozen, salted"
intersection,"pretzels, soft, from frozen, topped with cheese"
intersection,"pretzels, soft, from frozen, topped with meat"
intersection,"pretzels, soft, from frozen, unsalted"
intersection,"pretzels, soft, from school lunch"
intersection,"pretzels, soft, gluten free"
intersection,"pretzels, soft, gluten free, cinnamon sugar coated"
intersection,"pretzels, soft, gluten free, coated or flavored"
intersection,"pretzels, soft, multigrain"
intersection,"pretzels, soft, nfs"
intersection,"pretzels, soft, ready-to-eat, cinnamon sugar coated"
intersection,"pretzels, soft, ready-to-eat, coated or flavored"
intersection,"pretzels, soft, ready-to-eat, nfs"
intersection,"pretzels, soft, ready-to-eat, salted, buttered"
intersection,"pretzels, soft, ready-to-eat, salted, no butter"
intersection,"pretzels, soft, ready-to-eat, topped with cheese"
intersection,"pretzels, soft, ready-to-eat, topped with meat"
intersection,"pretzels, soft, ready-to-eat, unsalted, buttered"
intersection,"pretzels, soft, ready-to-eat, unsalted, no butter"
intersection,"prune juice, 100%"
intersection,"prune, dried"
intersection,"pudding, bread"
intersection,"pudding, chocolate, made from dry mix"
intersection,"pudding, chocolate, made from dry mix, sugar free"
intersection,"pudding, chocolate, nfs"
intersection,"pudding, chocolate, ready-to-eat"
intersection,"pudding, chocolate, ready-to-eat, sugar free"
intersection,"pudding, flavors other than chocolate, made from dry mix"
intersection,"pudding, flavors other than chocolate, made from dry mix, sugar free"
intersection,"pudding, flavors other than chocolate, nfs"
intersection,"pudding, flavors other than chocolate, ready-to-eat"
intersection,"pudding, flavors other than chocolate, ready-to-eat, sugar free"
intersection,"pudding, rice"
intersection,"pudding, tapioca, made from dry mix"
intersection,"pudding, tapioca, ready-to-eat"
intersection,puerto rican pasteles
intersection,puerto rican seasoning with ham
intersection,puerto rican seasoning without ham and tomato sauce
intersection,puerto rican white cheese
intersection,"puffs, fried, crab meat and cream cheese filled"
intersection,"pumpkin seeds, nfs"
intersection,"pumpkin seeds, salted"
intersection,"pumpkin seeds, unsalted"
intersection,"pumpkin, canned, cooked"
intersection,"pumpkin, cooked"
intersection,"pupusa, cheese only"
intersection,"pupusa, meat"
intersection,"pupusa, meat, with beans"
intersection,"pupusa, with beans"
intersection,"quail egg, canned"
intersection,"quail, cooked"
intersection,quarter pounder (mcdonalds)
intersection,quarter pounder with cheese (mcdonalds)
intersection,"quesadilla, beef or pork"
intersection,"quesadilla, beef or pork, with vegetables"
intersection,"quesadilla, cheese only"
intersection,"quesadilla, chicken"
intersection,"quesadilla, chicken, with vegetables"
intersection,"quesadilla, egg"
intersection,"quesadilla, egg, with meat"
intersection,"quesadilla, nfs"
intersection,"quesadilla, with vegetables"
intersection,"queso anejo, aged mexican cheese"
intersection,queso asadero
intersection,queso cotija
intersection,queso fresco
intersection,"quiche with meat, poultry or fish"
intersection,"quinoa, fat added"
intersection,"quinoa, no added fat"
intersection,"quinoa, ns as to fat"
intersection,rabbit
intersection,raccoon
intersection,"radicchio, raw"
intersection,radish
intersection,"radishes, pickled"
intersection,raisins
intersection,ramen bowl with beef
intersection,ramen bowl with chicken
intersection,ramen bowl with fish
intersection,ramen bowl with meat and egg
intersection,"ramen bowl, nfs"
intersection,"ramen bowl, vegetarian"
intersection,"ramen bowl, vegetarian with egg"
intersection,"ranch dip, light"
intersection,"ranch dip, regular"
intersection,"ranch dip, yogurt based"
intersection,ranch dressing
intersection,"ranch dressing, fat free"
intersection,"ranch dressing, light"
intersection,"raspberries, frozen"
intersection,"raspberries, raw"
intersection,ratatouille
intersection,"ravioli, cheese and spinach filled, with tomato sauce"
intersection,"ravioli, cheese and spinach-filled, no sauce"
intersection,"ravioli, cheese and spinach-filled, with cream sauce"
intersection,"ravioli, cheese-filled, no sauce"
intersection,"ravioli, cheese-filled, with cream sauce"
intersection,"ravioli, cheese-filled, with meat sauce"
intersection,"ravioli, cheese-filled, with tomato sauce"
intersection,"ravioli, cheese-filled, with tomato sauce, canned"
intersection,"ravioli, meat-filled, no sauce"
intersection,"ravioli, meat-filled, with cream sauce"
intersection,"ravioli, meat-filled, with tomato sauce or meat sauce"
intersection,"ravioli, meat-filled, with tomato sauce or meat sauce, canned"
intersection,"ravioli, ns as to filling, no sauce"
intersection,"ravioli, ns as to filling, with cream sauce"
intersection,"ravioli, ns as to filling, with tomato sauce"
intersection,"raw vegetable, nfs"
intersection,"red pepper, cooked, as ingredient"
intersection,refried beans
intersection,refried beans with meat
intersection,"refried beans, from canned, reduced sodium"
intersection,"refried beans, from fast food / restaurant"
intersection,"relish, corn"
intersection,"relish, pickle"
intersection,reuben sandwich
intersection,rhubarb
intersection,"ribs, nfs"
intersection,rice cake
intersection,rice croquette
intersection,rice dessert or salad with fruit
intersection,rice dressing
intersection,rice milk
intersection,"rice noodles, cooked"
intersection,rice paper
intersection,rice pilaf
intersection,rice with raisins
intersection,"rice with spanish sausage, puerto rican style"
intersection,"rice with squid, puerto rican style"
intersection,"rice with stewed beans, puerto rican style"
intersection,"rice with vienna sausage, puerto rican style"
intersection,"rice, brown and wild, cooked, fat added"
intersection,"rice, brown and wild, cooked, no added fat"
intersection,"rice, brown and wild, cooked, ns as to fat"
intersection,"rice, brown, cooked, as ingredient"
intersection,"rice, brown, cooked, fat added, made with oil"
intersection,"rice, brown, cooked, fat added, ns as to fat type"
intersection,"rice, brown, cooked, made with butter"
intersection,"rice, brown, cooked, made with margarine"
intersection,"rice, brown, cooked, no added fat"
intersection,"rice, brown, cooked, ns as to fat"
intersection,"rice, brown, with carrots and dark green vegetables, fat added"
intersection,"rice, brown, with carrots and dark green vegetables, no added fat"
intersection,"rice, brown, with carrots and dark green vegetables, ns as to fat"
intersection,"rice, brown, with carrots and tomatoes and/or tomato-based sauce, fat added"
intersection,"rice, brown, with carrots and tomatoes and/or tomato-based sauce, no added fat"
intersection,"rice, brown, with carrots and tomatoes and/or tomato-based sauce, ns as to fat"
intersection,"rice, brown, with carrots, dark green vegetables, and tomatoes and/or tomato-based sauce, fat added"
intersection,"rice, brown, with carrots, dark green vegetables, and tomatoes and/or tomato-based sauce, no added fat"
intersection,"rice, brown, with carrots, dark green vegetables, and tomatoes and/or tomato-based sauce, ns as to fat"
intersection,"rice, brown, with carrots, fat added"
intersection,"rice, brown, with carrots, no added fat"
intersection,"rice, brown, with carrots, ns as to fat"
intersection,"rice, brown, with cheese and/or cream based sauce, fat added"
intersection,"rice, brown, with cheese and/or cream based sauce, no added fat"
intersection,"rice, brown, with cheese and/or cream based sauce, ns as to fat"
intersection,"rice, brown, with corn, fat added"
intersection,"rice, brown, with corn, no added fat"
intersection,"rice, brown, with corn, ns as to fat"
intersection,"rice, brown, with dark green vegetables and tomatoes and/or tomato-based sauce, fat added"
intersection,"rice, brown, with dark green vegetables and tomatoes and/or tomato-based sauce, no added fat"
intersection,"rice, brown, with dark green vegetables and tomatoes and/or tomato-based sauce, ns as to fat"
intersection,"rice, brown, with dark green vegetables, fat added"
intersection,"rice, brown, with dark green vegetables, no added fat"
intersection,"rice, brown, with dark green vegetables, ns as to fat"
intersection,"rice, brown, with gravy, fat added"
intersection,"rice, brown, with gravy, no added fat"
intersection,"rice, brown, with gravy, ns as to fat"
intersection,"rice, brown, with other vegetables, fat added"
intersection,"rice, brown, with other vegetables, no added fat"
intersection,"rice, brown, with other vegetables, ns as to fat"
intersection,"rice, brown, with peas and carrots, fat added"
intersection,"rice, brown, with peas and carrots, no added fat"
intersection,"rice, brown, with peas and carrots, ns as to fat"
intersection,"rice, brown, with peas, fat added"
intersection,"rice, brown, with peas, no added fat"
intersection,"rice, brown, with peas, ns as to fat"
intersection,"rice, brown, with soy-based sauce, fat added"
intersection,"rice, brown, with soy-based sauce, no added fat"
intersection,"rice, brown, with soy-based sauce, ns as to fat"
intersection,"rice, brown, with tomatoes and/or tomato based sauce, fat added"
intersection,"rice, brown, with tomatoes and/or tomato based sauce, no added fat"
intersection,"rice, brown, with tomatoes and/or tomato based sauce, ns as to fat"
intersection,"rice, brown, with vegetables and gravy, fat added"
intersection,"rice, brown, with vegetables and gravy, no added fat"
intersection,"rice, brown, with vegetables and gravy, ns as to fat"
intersection,"rice, brown, with vegetables, cheese and/or cream based sauce, fat added"
intersection,"rice, brown, with vegetables, cheese and/or cream based sauce, no added fat"
intersection,"rice, brown, with vegetables, cheese and/or cream based sauce, ns as to fat"
intersection,"rice, brown, with vegetables, soy-based sauce, fat added"
intersection,"rice, brown, with vegetables, soy-based sauce, no added fat"
intersection,"rice, brown, with vegetables, soy-based sauce, ns as to fat"
intersection,"rice, cooked with coconut milk"
intersection,"rice, cooked, nfs"
intersection,"rice, cooked, with milk"
intersection,"rice, fried, meatless"
intersection,"rice, fried, nfs"
intersection,"rice, fried, with beef"
intersection,"rice, fried, with chicken"
intersection,"rice, fried, with pork"
intersection,"rice, fried, with shrimp"
intersection,"rice, sweet, cooked with honey"
intersection,"rice, white and wild, cooked, fat added"
intersection,"rice, white and wild, cooked, no added fat"
intersection,"rice, white and wild, cooked, ns as to fat"
intersection,"rice, white, cooked with fat, puerto rican style"
intersection,"rice, white, cooked, as ingredient"
intersection,"rice, white, cooked, fat added, ns as to fat type"
intersection,"rice, white, cooked, glutinous"
intersection,"rice, white, cooked, made with butter"
intersection,"rice, white, cooked, made with margarine"
intersection,"rice, white, cooked, made with oil"
intersection,"rice, white, cooked, no added fat"
intersection,"rice, white, cooked, ns as to fat"
intersection,"rice, white, with carrots and dark green vegetables, fat added"
intersection,"rice, white, with carrots and dark green vegetables, no added fat"
intersection,"rice, white, with carrots and dark green vegetables, ns as to fat"
intersection,"rice, white, with carrots and tomatoes and/or tomato-based sauce, fat added"
intersection,"rice, white, with carrots and tomatoes and/or tomato-based sauce, no added fat"
intersection,"rice, white, with carrots and tomatoes and/or tomato-based sauce, ns as to fat"
intersection,"rice, white, with carrots, dark green vegetables, and tomatoes and/or tomato-based sauce, fat added"
intersection,"rice, white, with carrots, dark green vegetables, and tomatoes and/or tomato-based sauce, no added fat"
intersection,"rice, white, with carrots, dark green vegetables, and tomatoes and/or tomato-based sauce, ns as to fat"
intersection,"rice, white, with carrots, fat added"
intersection,"rice, white, with carrots, no added fat"
intersection,"rice, white, with carrots, ns as to fat"
intersection,"rice, white, with cheese and/or cream based sauce, fat added"
intersection,"rice, white, with cheese and/or cream based sauce, no added fat"
intersection,"rice, white, with cheese and/or cream based sauce, ns as to fat"
intersection,"rice, white, with corn, fat added"
intersection,"rice, white, with corn, no added fat"
intersection,"rice, white, with corn, ns as to fat"
intersection,"rice, white, with dark green vegetables and tomatoes and/or tomato-based sauce, fat added"
intersection,"rice, white, with dark green vegetables and tomatoes and/or tomato-based sauce, no added fat"
intersection,"rice, white, with dark green vegetables and tomatoes and/or tomato-based sauce, ns as to fat"
intersection,"rice, white, with dark green vegetables, fat added"
intersection,"rice, white, with dark green vegetables, no added fat"
intersection,"rice, white, with dark green vegetables, ns as to fat"
intersection,"rice, white, with gravy, fat added"
intersection,"rice, white, with gravy, no added fat"
intersection,"rice, white, with gravy, ns as to fat"
intersection,"rice, white, with lentils, fat added"
intersection,"rice, white, with lentils, no added fat"
intersection,"rice, white, with lentils, ns as to fat"
intersection,"rice, white, with other vegetables, fat added"
intersection,"rice, white, with other vegetables, no added fat"
intersection,"rice, white, with other vegetables, ns as to fat"
intersection,"rice, white, with peas and carrots, fat added"
intersection,"rice, white, with peas and carrots, no added fat"
intersection,"rice, white, with peas and carrots, ns as to fat"
intersection,"rice, white, with peas, fat added"
intersection,"rice, white, with peas, no added fat"
intersection,"rice, white, with peas, ns as to fat"
intersection,"rice, white, with soy-based sauce, fat added"
intersection,"rice, white, with soy-based sauce, no added fat"
intersection,"rice, white, with soy-based sauce, ns as to fat"
intersection,"rice, white, with tomatoes and/or tomato-based sauce, fat added"
intersection,"rice, white, with tomatoes and/or tomato-based sauce, no added fat"
intersection,"rice, white, with tomatoes and/or tomato-based sauce, ns as to fat"
intersection,"rice, white, with vegetables and gravy, fat added"
intersection,"rice, white, with vegetables and gravy, no added fat"
intersection,"rice, white, with vegetables and gravy, ns as to fat"
intersection,"rice, white, with vegetables, cheese and/or cream based sauce, fat added"
intersection,"rice, white, with vegetables, cheese and/or cream based sauce, no added fat"
intersection,"rice, white, with vegetables, cheese and/or cream based sauce, ns as to fat"
intersection,"rice, white, with vegetables, soy-based sauce, fat added"
intersection,"rice, white, with vegetables, soy-based sauce, no added fat"
intersection,"rice, white, with vegetables, soy-based sauce, ns as to fat"
intersection,"rice, wild, 100%, cooked, fat added"
intersection,"rice, wild, 100%, cooked, no added fat"
intersection,"rice, wild, 100%, cooked, ns as to fat"
intersection,"ripe plantain meat pie, puerto rican style"
intersection,roast beef sandwich on wheat
intersection,"roast beef sandwich on wheat, with cheese"
intersection,roast beef sandwich on white
intersection,"roast beef sandwich on white, with cheese"
intersection,rob roy
intersection,"roll with meat and/or shrimp, vegetables and rice paper, not fried"
intersection,"roll, bran, ns as to type of bran"
intersection,"roll, cheese"
intersection,"roll, diet"
intersection,"roll, egg bread"
intersection,"roll, french or vienna"
intersection,"roll, garlic"
intersection,"roll, gluten free"
intersection,"roll, hard, ns as to major flour"
intersection,"roll, mexican, bolillo"
intersection,"roll, multigrain"
intersection,"roll, multigrain, hamburger bun"
intersection,"roll, multigrain, hot dog bun"
intersection,"roll, ns as to major flour"
intersection,"roll, oatmeal"
intersection,"roll, pumpernickel"
intersection,"roll, rye"
intersection,"roll, sour dough"
intersection,"roll, sweet, cinnamon bun, frosted"
intersection,"roll, sweet, cinnamon bun, no frosting"
intersection,"roll, sweet, frosted"
intersection,"roll, sweet, no frosting"
intersection,"roll, sweet, with fruit, frosted"
intersection,"roll, sweet, with fruit, frosted, diet"
intersection,"roll, wheat or cracked wheat"
intersection,"roll, wheat or cracked wheat, hamburger bun"
intersection,"roll, wheat or cracked wheat, hot dog bun"
intersection,"roll, white, hamburger bun"
intersection,"roll, white, hard"
intersection,"roll, white, hoagie, submarine"
intersection,"roll, white, hot dog bun"
intersection,"roll, white, soft"
intersection,"roll, whole grain white"
intersection,"roll, whole grain white, hamburger bun"
intersection,"roll, whole grain white, hot dog bun"
intersection,"roll, whole wheat"
intersection,"roll, whole wheat, hamburger bun"
intersection,"roll, whole wheat, hot dog bun"
intersection,"romaine lettuce, raw"
intersection,rum
intersection,rum and cola
intersection,rum and diet cola
intersection,"rum, hot buttered"
intersection,russian dressing
intersection,rusty nail
intersection,"rutabaga, cooked"
intersection,"rutabaga, raw"
intersection,safflower oil
intersection,"salad dressing, fat free, nfs"
intersection,"salad dressing, light, nfs"
intersection,"salad dressing, nfs, for salads"
intersection,"salad dressing, nfs, for sandwiches"
intersection,salami sandwich on wheat
intersection,"salami sandwich on wheat, with cheese"
intersection,salami sandwich on white
intersection,"salami sandwich on white, with cheese"
intersection,"salami, made from any type of meat, reduced fat"
intersection,"salami, made from any type of meat, reduced sodium"
intersection,"salami, nfs"
intersection,"salisbury steak dinner, nfs, frozen meal"
